{
  "$schema": "https://json-schema.org/draft/2020-12/schema",
  "$id": "https://tianji.example/schema/knowledge/1.0",
  "type": "object",
  "required": [
    "schema_version",
    "model",
    "domain",
    "classics",
    "chapters",
    "sections",
    "terms",
    "rules",
    "concepts"
  ],
  "properties": {
    "schema_version": {
      "const": "1.0"
    },
    "model": {
      "const": "phase1-knowledge"
    },
    "domain": {
      "enum": [
        "yijing",
        "liuyao",
        "qimen",
        "ziwei",
        "fengshui",
        "liuren"
      ]
    },
    "classics": {
      "type": "array",
      "items": {
        "$ref": "#/$defs/classic"
      }
    },
    "chapters": {
      "type": "array",
      "items": {
        "$ref": "#/$defs/chapter"
      }
    },
    "sections": {
      "type": "array",
      "items": {
        "$ref": "#/$defs/section"
      }
    },
    "terms": {
      "type": "array",
      "items": {
        "$ref": "#/$defs/term"
      }
    },
    "rules": {
      "type": "array",
      "items": {
        "$ref": "#/$defs/rule"
      }
    },
    "concepts": {
      "type": "array",
      "items": {
        "$ref": "#/$defs/concept"
      }
    }
  },
  "additionalProperties": false,
  "$defs": {
    "source_ref": {
      "type": "object",
      "required": [
        "source_id",
        "section_id",
        "original_text",
        "role"
      ],
      "properties": {
        "source_id": {
          "type": "string",
          "pattern": "^[a-z][a-z0-9_.-]*$"
        },
        "section_id": {
          "type": "string",
          "pattern": "^[a-z][a-z0-9_.-]*$"
        },
        "original_text": {
          "type": "string",
          "minLength": 1
        },
        "role": {
          "enum": [
            "classical",
            "implementation",
            "derivation"
          ]
        }
      },
      "additionalProperties": false
    },
    "classic": {
      "type": "object",
      "required": [
        "id",
        "domain",
        "name",
        "source_id",
        "body_stage"
      ],
      "properties": {
        "id": {
          "type": "string",
          "pattern": "^[a-z][a-z0-9_.-]*$"
        },
        "domain": {
          "enum": [
            "yijing",
            "liuyao",
            "qimen",
            "ziwei",
            "fengshui",
            "liuren"
          ]
        },
        "name": {
          "type": "string",
          "minLength": 1
        },
        "source_refs": {
          "type": "array",
          "minItems": 1,
          "items": {
            "$ref": "#/$defs/source_ref"
          }
        },
        "confidence": {
          "enum": [
            "high",
            "medium",
            "low"
          ]
        },
        "school": {
          "type": "string",
          "minLength": 1
        },
        "variant": {
          "type": "string",
          "minLength": 1
        },
        "difference": {
          "type": "string"
        },
        "term_refs": {
          "type": "array",
          "items": {
            "type": "string",
            "minLength": 1
          },
          "uniqueItems": true
        },
        "related_terms": {
          "type": "array",
          "items": {
            "type": "string",
            "minLength": 1
          },
          "uniqueItems": true
        },
        "classic_id": {
          "type": "string",
          "pattern": "^[a-z][a-z0-9_.-]*$"
        },
        "chapter_id": {
          "type": "string",
          "pattern": "^[a-z][a-z0-9_.-]*$"
        },
        "source_id": {
          "type": "string",
          "pattern": "^[a-z][a-z0-9_.-]*$"
        },
        "body_stage": {
          "enum": [
            "canonical",
            "quarantine",
            "metadata_only"
          ]
        },
        "canonical_path": {
          "type": "string",
          "minLength": 1
        }
      },
      "additionalProperties": false
    },
    "chapter": {
      "type": "object",
      "required": [
        "id",
        "domain",
        "name",
        "classic_id",
        "locator"
      ],
      "properties": {
        "id": {
          "type": "string",
          "pattern": "^[a-z][a-z0-9_.-]*$"
        },
        "domain": {
          "enum": [
            "yijing",
            "liuyao",
            "qimen",
            "ziwei",
            "fengshui",
            "liuren"
          ]
        },
        "name": {
          "type": "string",
          "minLength": 1
        },
        "source_refs": {
          "type": "array",
          "minItems": 1,
          "items": {
            "$ref": "#/$defs/source_ref"
          }
        },
        "confidence": {
          "enum": [
            "high",
            "medium",
            "low"
          ]
        },
        "school": {
          "type": "string",
          "minLength": 1
        },
        "variant": {
          "type": "string",
          "minLength": 1
        },
        "difference": {
          "type": "string"
        },
        "term_refs": {
          "type": "array",
          "items": {
            "type": "string",
            "minLength": 1
          },
          "uniqueItems": true
        },
        "related_terms": {
          "type": "array",
          "items": {
            "type": "string",
            "minLength": 1
          },
          "uniqueItems": true
        },
        "classic_id": {
          "type": "string",
          "pattern": "^[a-z][a-z0-9_.-]*$"
        },
        "chapter_id": {
          "type": "string",
          "pattern": "^[a-z][a-z0-9_.-]*$"
        },
        "locator": {
          "type": "string",
          "minLength": 1
        }
      },
      "additionalProperties": false
    },
    "section": {
      "type": "object",
      "required": [
        "id",
        "domain",
        "name",
        "classic_id",
        "chapter_id",
        "source_id",
        "text",
        "locator",
        "review"
      ],
      "properties": {
        "id": {
          "type": "string",
          "pattern": "^[a-z][a-z0-9_.-]*$"
        },
        "domain": {
          "enum": [
            "yijing",
            "liuyao",
            "qimen",
            "ziwei",
            "fengshui",
            "liuren"
          ]
        },
        "name": {
          "type": "string",
          "minLength": 1
        },
        "source_refs": {
          "type": "array",
          "minItems": 1,
          "items": {
            "$ref": "#/$defs/source_ref"
          }
        },
        "confidence": {
          "enum": [
            "high",
            "medium",
            "low"
          ]
        },
        "school": {
          "type": "string",
          "minLength": 1
        },
        "variant": {
          "type": "string",
          "minLength": 1
        },
        "difference": {
          "type": "string"
        },
        "term_refs": {
          "type": "array",
          "items": {
            "type": "string",
            "minLength": 1
          },
          "uniqueItems": true
        },
        "related_terms": {
          "type": "array",
          "items": {
            "type": "string",
            "minLength": 1
          },
          "uniqueItems": true
        },
        "classic_id": {
          "type": "string",
          "pattern": "^[a-z][a-z0-9_.-]*$"
        },
        "chapter_id": {
          "type": "string",
          "pattern": "^[a-z][a-z0-9_.-]*$"
        },
        "source_id": {
          "type": "string",
          "pattern": "^[a-z][a-z0-9_.-]*$"
        },
        "text": {
          "type": "string",
          "minLength": 1
        },
        "locator": {
          "type": "string",
          "minLength": 1
        },
        "review": {
          "type": "object",
          "required": [
            "status",
            "method",
            "scope"
          ],
          "properties": {
            "status": {
              "const": "approved"
            },
            "method": {
              "type": "string",
              "minLength": 1
            },
            "scope": {
              "type": "string",
              "minLength": 1
            }
          },
          "additionalProperties": false
        }
      },
      "additionalProperties": false
    },
    "term": {
      "type": "object",
      "required": [
        "id",
        "domain",
        "name",
        "definition",
        "aliases",
        "source_refs",
        "related_terms",
        "confidence"
      ],
      "properties": {
        "id": {
          "type": "string",
          "pattern": "^[a-z][a-z0-9_.-]*$"
        },
        "domain": {
          "enum": [
            "yijing",
            "liuyao",
            "qimen",
            "ziwei",
            "fengshui",
            "liuren"
          ]
        },
        "name": {
          "type": "string",
          "minLength": 1
        },
        "source_refs": {
          "type": "array",
          "minItems": 1,
          "items": {
            "$ref": "#/$defs/source_ref"
          }
        },
        "confidence": {
          "enum": [
            "high",
            "medium",
            "low"
          ]
        },
        "school": {
          "type": "string",
          "minLength": 1
        },
        "variant": {
          "type": "string",
          "minLength": 1
        },
        "difference": {
          "type": "string"
        },
        "term_refs": {
          "type": "array",
          "items": {
            "type": "string",
            "minLength": 1
          },
          "uniqueItems": true
        },
        "related_terms": {
          "type": "array",
          "items": {
            "type": "string",
            "minLength": 1
          },
          "uniqueItems": true
        },
        "classic_id": {
          "type": "string",
          "pattern": "^[a-z][a-z0-9_.-]*$"
        },
        "chapter_id": {
          "type": "string",
          "pattern": "^[a-z][a-z0-9_.-]*$"
        },
        "definition": {
          "type": "string",
          "minLength": 1
        },
        "aliases": {
          "type": "array",
          "items": {
            "type": "string",
            "minLength": 1
          },
          "uniqueItems": true
        },
        "attributes": {
          "type": "object"
        }
      },
      "additionalProperties": false
    },
    "rule": {
      "type": "object",
      "required": [
        "id",
        "domain",
        "name",
        "conditions",
        "inputs",
        "operation",
        "result",
        "exceptions",
        "execution_status",
        "school",
        "variant",
        "difference",
        "source_refs",
        "confidence",
        "term_refs"
      ],
      "properties": {
        "id": {
          "type": "string",
          "pattern": "^[a-z][a-z0-9_.-]*$"
        },
        "domain": {
          "enum": [
            "yijing",
            "liuyao",
            "qimen",
            "ziwei",
            "fengshui",
            "liuren"
          ]
        },
        "name": {
          "type": "string",
          "minLength": 1
        },
        "source_refs": {
          "type": "array",
          "minItems": 1,
          "items": {
            "$ref": "#/$defs/source_ref"
          }
        },
        "confidence": {
          "enum": [
            "high",
            "medium",
            "low"
          ]
        },
        "school": {
          "type": "string",
          "minLength": 1
        },
        "variant": {
          "type": "string",
          "minLength": 1
        },
        "difference": {
          "type": "string"
        },
        "term_refs": {
          "type": "array",
          "items": {
            "type": "string",
            "minLength": 1
          },
          "uniqueItems": true
        },
        "related_terms": {
          "type": "array",
          "items": {
            "type": "string",
            "minLength": 1
          },
          "uniqueItems": true
        },
        "classic_id": {
          "type": "string",
          "pattern": "^[a-z][a-z0-9_.-]*$"
        },
        "chapter_id": {
          "type": "string",
          "pattern": "^[a-z][a-z0-9_.-]*$"
        },
        "conditions": {
          "type": "array",
          "items": {
            "type": "string",
            "minLength": 1
          }
        },
        "inputs": {
          "type": "object"
        },
        "operation": {
          "type": "object",
          "required": [
            "kind"
          ],
          "properties": {
            "kind": {
              "type": "string",
              "minLength": 1
            },
            "provider": {
              "type": "string",
              "minLength": 1
            },
            "parameters": {
              "type": "object"
            },
            "source_id": {
              "type": "string",
              "minLength": 1
            }
          },
          "additionalProperties": false
        },
        "result": {
          "type": "object"
        },
        "exceptions": {
          "type": "array",
          "items": {
            "type": "string",
            "minLength": 1
          }
        },
        "execution_status": {
          "enum": [
            "executable",
            "partially_structured",
            "descriptive_only"
          ]
        }
      },
      "additionalProperties": false
    },
    "concept": {
      "type": "object",
      "required": [
        "id",
        "domain",
        "name",
        "kind",
        "attributes",
        "source_refs",
        "confidence"
      ],
      "properties": {
        "id": {
          "type": "string",
          "pattern": "^[a-z][a-z0-9_.-]*$"
        },
        "domain": {
          "enum": [
            "yijing",
            "liuyao",
            "qimen",
            "ziwei",
            "fengshui",
            "liuren"
          ]
        },
        "name": {
          "type": "string",
          "minLength": 1
        },
        "source_refs": {
          "type": "array",
          "minItems": 1,
          "items": {
            "$ref": "#/$defs/source_ref"
          }
        },
        "confidence": {
          "enum": [
            "high",
            "medium",
            "low"
          ]
        },
        "school": {
          "type": "string",
          "minLength": 1
        },
        "variant": {
          "type": "string",
          "minLength": 1
        },
        "difference": {
          "type": "string"
        },
        "term_refs": {
          "type": "array",
          "items": {
            "type": "string",
            "minLength": 1
          },
          "uniqueItems": true
        },
        "related_terms": {
          "type": "array",
          "items": {
            "type": "string",
            "minLength": 1
          },
          "uniqueItems": true
        },
        "classic_id": {
          "type": "string",
          "pattern": "^[a-z][a-z0-9_.-]*$"
        },
        "chapter_id": {
          "type": "string",
          "pattern": "^[a-z][a-z0-9_.-]*$"
        },
        "kind": {
          "type": "string",
          "minLength": 1
        },
        "attributes": {
          "type": "object"
        }
      },
      "additionalProperties": false
    }
  }
}
