{
  "schema_version": "1.0",
  "model": "phase1-knowledge",
  "domain": "qimen",
  "classics": [
    {
      "id": "qimen.classic.tongzong",
      "domain": "qimen",
      "name": "奇门遁甲统宗",
      "source_id": "qimen.source.tongzong",
      "body_stage": "quarantine"
    },
    {
      "id": "qimen.classic.baojian",
      "domain": "qimen",
      "name": "奇门宝鉴御定",
      "source_id": "qimen.source.baojian",
      "body_stage": "quarantine"
    }
  ],
  "chapters": [
    {
      "id": "qimen.chapter.baojian.8cff2b9d",
      "domain": "qimen",
      "name": "基础选段（编者定位）",
      "classic_id": "qimen.classic.baojian",
      "locator": "基础选段（编者定位）"
    },
    {
      "id": "qimen.chapter.tongzong.8cff2b9d",
      "domain": "qimen",
      "name": "基础选段（编者定位）",
      "classic_id": "qimen.classic.tongzong",
      "locator": "基础选段（编者定位）"
    },
    {
      "id": "qimen.chapter.tongzong.4bbde1d3",
      "domain": "qimen",
      "name": "九星类神·五行颜色",
      "classic_id": "qimen.classic.tongzong",
      "locator": "九星类神·五行颜色"
    },
    {
      "id": "qimen.chapter.baojian.158af429",
      "domain": "qimen",
      "name": "释义四十四则·释门",
      "classic_id": "qimen.classic.baojian",
      "locator": "释义四十四则·释门"
    },
    {
      "id": "qimen.chapter.baojian.c187e5a4",
      "domain": "qimen",
      "name": "释义四十四则·释八神",
      "classic_id": "qimen.classic.baojian",
      "locator": "释义四十四则·释八神"
    },
    {
      "id": "qimen.chapter.tongzong.907f3f12",
      "domain": "qimen",
      "name": "卷一·论超接之法",
      "classic_id": "qimen.classic.tongzong",
      "locator": "卷一·论超接之法"
    }
  ],
  "sections": [
    {
      "id": "qimen.section.s001",
      "domain": "qimen",
      "name": "基础选段（编者定位）·选段1",
      "classic_id": "qimen.classic.baojian",
      "chapter_id": "qimen.chapter.baojian.8cff2b9d",
      "source_id": "qimen.source.baojian",
      "text": "五数为中，戴九履一、左三右七、二四为上、六八为下，符于遁甲。",
      "locator": "基础选段（编者定位）; decoded-character interval [468,498)",
      "review": {
        "status": "approved",
        "method": "逐字核对固定证据文件；限定选段；显著缺文、PUA 和现代注释不晋级。",
        "scope": "仅本选段；不推广为整本校勘或现实吉凶结论。"
      }
    },
    {
      "id": "qimen.section.s002",
      "domain": "qimen",
      "name": "基础选段（编者定位）·选段2",
      "classic_id": "qimen.classic.tongzong",
      "chapter_id": "qimen.chapter.tongzong.8cff2b9d",
      "source_id": "qimen.source.tongzong",
      "text": "八门为值使，后定方位为奇。",
      "locator": "基础选段（编者定位）; decoded-character interval [4940,4953)",
      "review": {
        "status": "approved",
        "method": "逐字核对固定证据文件；限定选段；显著缺文、PUA 和现代注释不晋级。",
        "scope": "仅本选段；不推广为整本校勘或现实吉凶结论。"
      }
    },
    {
      "id": "qimen.section.s003",
      "domain": "qimen",
      "name": "基础选段（编者定位）·选段3",
      "classic_id": "qimen.classic.tongzong",
      "chapter_id": "qimen.chapter.tongzong.8cff2b9d",
      "source_id": "qimen.source.tongzong",
      "text": "九星常为值符用，十时一易，每用加时干是",
      "locator": "基础选段（编者定位）; decoded-character interval [4920,4939)",
      "review": {
        "status": "approved",
        "method": "逐字核对固定证据文件；限定选段；显著缺文、PUA 和现代注释不晋级。",
        "scope": "仅本选段；不推广为整本校勘或现实吉凶结论。"
      }
    },
    {
      "id": "qimen.section.s004",
      "domain": "qimen",
      "name": "基础选段（编者定位）·选段4",
      "classic_id": "qimen.classic.baojian",
      "chapter_id": "qimen.chapter.baojian.8cff2b9d",
      "source_id": "qimen.source.baojian",
      "text": "八神者；天乙、螣蛇、太阴、六合、朱雀、白虎、九地、九天也。",
      "locator": "基础选段（编者定位）; decoded-character interval [3302,3331)",
      "review": {
        "status": "approved",
        "method": "逐字核对固定证据文件；限定选段；显著缺文、PUA 和现代注释不晋级。",
        "scope": "仅本选段；不推广为整本校勘或现实吉凶结论。"
      }
    },
    {
      "id": "qimen.section.s005",
      "domain": "qimen",
      "name": "基础选段（编者定位）·选段5",
      "classic_id": "qimen.classic.baojian",
      "chapter_id": "qimen.chapter.baojian.8cff2b9d",
      "source_id": "qimen.source.baojian",
      "text": "乙为日奇、丙为月奇、丁为星奇，故名三奇。",
      "locator": "基础选段（编者定位）; decoded-character interval [2406,2426)",
      "review": {
        "status": "approved",
        "method": "逐字核对固定证据文件；限定选段；显著缺文、PUA 和现代注释不晋级。",
        "scope": "仅本选段；不推广为整本校勘或现实吉凶结论。"
      }
    },
    {
      "id": "qimen.section.s006",
      "domain": "qimen",
      "name": "基础选段（编者定位）·选段6",
      "classic_id": "qimen.classic.baojian",
      "chapter_id": "qimen.chapter.baojian.8cff2b9d",
      "source_id": "qimen.source.baojian",
      "text": "戊己庚辛壬癸，皆有六甲遁乎其中",
      "locator": "基础选段（编者定位）; decoded-character interval [2437,2452)",
      "review": {
        "status": "approved",
        "method": "逐字核对固定证据文件；限定选段；显著缺文、PUA 和现代注释不晋级。",
        "scope": "仅本选段；不推广为整本校勘或现实吉凶结论。"
      }
    },
    {
      "id": "qimen.section.s007",
      "domain": "qimen",
      "name": "基础选段（编者定位）·选段7",
      "classic_id": "qimen.classic.baojian",
      "chapter_id": "qimen.chapter.baojian.8cff2b9d",
      "source_id": "qimen.source.baojian",
      "text": "本局地盘不动，以天盘甲子戊加乙于九宫。",
      "locator": "基础选段（编者定位）; decoded-character interval [8552,8571)",
      "review": {
        "status": "approved",
        "method": "逐字核对固定证据文件；限定选段；显著缺文、PUA 和现代注释不晋级。",
        "scope": "仅本选段；不推广为整本校勘或现实吉凶结论。"
      }
    },
    {
      "id": "qimen.section.s008",
      "domain": "qimen",
      "name": "基础选段（编者定位）·选段8",
      "classic_id": "qimen.classic.baojian",
      "chapter_id": "qimen.chapter.baojian.8cff2b9d",
      "source_id": "qimen.source.baojian",
      "text": "门作人盘贵独飞。",
      "locator": "基础选段（编者定位）; decoded-character interval [33010,33018)",
      "review": {
        "status": "approved",
        "method": "逐字核对固定证据文件；限定选段；显著缺文、PUA 和现代注释不晋级。",
        "scope": "仅本选段；不推广为整本校勘或现实吉凶结论。"
      }
    },
    {
      "id": "qimen.section.s009",
      "domain": "qimen",
      "name": "基础选段（编者定位）·选段9",
      "classic_id": "qimen.classic.tongzong",
      "chapter_id": "qimen.chapter.tongzong.8cff2b9d",
      "source_id": "qimen.source.tongzong",
      "text": "地盘旬首所临之宫，其星即为值符，其门即为值使。",
      "locator": "基础选段（编者定位）; decoded-character interval [10496,10519)",
      "review": {
        "status": "approved",
        "method": "逐字核对固定证据文件；限定选段；显著缺文、PUA 和现代注释不晋级。",
        "scope": "仅本选段；不推广为整本校勘或现实吉凶结论。"
      }
    },
    {
      "id": "qimen.section.s010",
      "domain": "qimen",
      "name": "基础选段（编者定位）·选段10",
      "classic_id": "qimen.classic.tongzong",
      "chapter_id": "qimen.chapter.tongzong.8cff2b9d",
      "source_id": "qimen.source.tongzong",
      "text": "自冬至阳生起坎一宫",
      "locator": "基础选段（编者定位）; decoded-character interval [4758,4767)",
      "review": {
        "status": "approved",
        "method": "逐字核对固定证据文件；限定选段；显著缺文、PUA 和现代注释不晋级。",
        "scope": "仅本选段；不推广为整本校勘或现实吉凶结论。"
      }
    },
    {
      "id": "qimen.section.s011",
      "domain": "qimen",
      "name": "基础选段（编者定位）·选段11",
      "classic_id": "qimen.classic.tongzong",
      "chapter_id": "qimen.chapter.tongzong.8cff2b9d",
      "source_id": "qimen.source.tongzong",
      "text": "自夏至气降起离九宫",
      "locator": "基础选段（编者定位）; decoded-character interval [4851,4860)",
      "review": {
        "status": "approved",
        "method": "逐字核对固定证据文件；限定选段；显著缺文、PUA 和现代注释不晋级。",
        "scope": "仅本选段；不推广为整本校勘或现实吉凶结论。"
      }
    },
    {
      "id": "qimen.section.s012",
      "domain": "qimen",
      "name": "基础选段（编者定位）·选段12",
      "classic_id": "qimen.classic.tongzong",
      "chapter_id": "qimen.chapter.tongzong.8cff2b9d",
      "source_id": "qimen.source.tongzong",
      "text": "一元五日，以甲己二干为一元之首，谓之符头。",
      "locator": "基础选段（编者定位）; decoded-character interval [10331,10352)",
      "review": {
        "status": "approved",
        "method": "逐字核对固定证据文件；限定选段；显著缺文、PUA 和现代注释不晋级。",
        "scope": "仅本选段；不推广为整本校勘或现实吉凶结论。"
      }
    },
    {
      "id": "qimen.section.s013",
      "domain": "qimen",
      "name": "基础选段（编者定位）·选段13",
      "classic_id": "qimen.classic.baojian",
      "chapter_id": "qimen.chapter.baojian.8cff2b9d",
      "source_id": "qimen.source.baojian",
      "text": "一节三元、二十四气备矣。",
      "locator": "基础选段（编者定位）; decoded-character interval [1286,1298)",
      "review": {
        "status": "approved",
        "method": "逐字核对固定证据文件；限定选段；显著缺文、PUA 和现代注释不晋级。",
        "scope": "仅本选段；不推广为整本校勘或现实吉凶结论。"
      }
    },
    {
      "id": "qimen.section.s014",
      "domain": "qimen",
      "name": "基础选段（编者定位）·选段14",
      "classic_id": "qimen.classic.tongzong",
      "chapter_id": "qimen.chapter.tongzong.8cff2b9d",
      "source_id": "qimen.source.tongzong",
      "text": "符头所临之支值子午卯酉则为上元；值寅申巳亥则为中元；值辰戌丑未则为下元。",
      "locator": "基础选段（编者定位）; decoded-character interval [10352,10388)",
      "review": {
        "status": "approved",
        "method": "逐字核对固定证据文件；限定选段；显著缺文、PUA 和现代注释不晋级。",
        "scope": "仅本选段；不推广为整本校勘或现实吉凶结论。"
      }
    },
    {
      "id": "qimen.section.s015",
      "domain": "qimen",
      "name": "九星类神·五行颜色·选段15",
      "classic_id": "qimen.classic.tongzong",
      "chapter_id": "qimen.chapter.tongzong.4bbde1d3",
      "source_id": "qimen.source.tongzong",
      "text": "天蓬水星其色为白",
      "locator": "九星类神·五行颜色; decoded-character interval [41826,41838)",
      "review": {
        "status": "approved",
        "method": "逐字核对固定证据文件；限定选段；显著缺文、PUA 和现代注释不晋级。",
        "scope": "仅本选段；不推广为整本校勘或现实吉凶结论。"
      }
    },
    {
      "id": "qimen.section.s016",
      "domain": "qimen",
      "name": "九星类神·五行颜色·选段16",
      "classic_id": "qimen.classic.tongzong",
      "chapter_id": "qimen.chapter.tongzong.4bbde1d3",
      "source_id": "qimen.source.tongzong",
      "text": "天芮土星其色为黑",
      "locator": "九星类神·五行颜色; decoded-character interval [41835,41847)",
      "review": {
        "status": "approved",
        "method": "逐字核对固定证据文件；限定选段；显著缺文、PUA 和现代注释不晋级。",
        "scope": "仅本选段；不推广为整本校勘或现实吉凶结论。"
      }
    },
    {
      "id": "qimen.section.s017",
      "domain": "qimen",
      "name": "九星类神·五行颜色·选段17",
      "classic_id": "qimen.classic.tongzong",
      "chapter_id": "qimen.chapter.tongzong.4bbde1d3",
      "source_id": "qimen.source.tongzong",